{
  "id": "calibrationprofile://worldspec/h1-menagerie-right-robotiq/stand-v1",
  "profileVersion": "0.1.0",
  "status": "research",
  "baseTrainingProfileDigest": "sha256:6c2002f7fedaae1739416c96e7698b389d8ddc7bedc7386921e141964128eec6",
  "runtime": {
    "containerImage": "ccr-29eug8s3-pub.cnc.bj.baidubce.com/dataflow-poc/worldspec-h1-training@sha256:60df896c6492f9c6aa9488c79e4a9ef9db79a2798473ae899bf9211e68733bec",
    "containerDigest": "sha256:60df896c6492f9c6aa9488c79e4a9ef9db79a2798473ae899bf9211e68733bec",
    "packageLockDigest": "sha256:7cc88f20b2c608d6fe673f3b994b879db69d75361206bf25f949d7acc5ed3a41"
  },
  "stage": "stand",
  "trainingOverrides": {
    "numTimesteps": 1048576,
    "numEnvs": 2048,
    "numEvals": 5,
    "episodeLength": 500,
    "unrollLength": 20,
    "numMinibatches": 16,
    "numUpdatesPerBatch": 4,
    "batchSize": 128
  },
  "environment": {
    "commandDistribution": {
      "linearVelocityX": [0.0, 0.0],
      "linearVelocityY": [0.0, 0.0],
      "angularVelocityYaw": [0.0, 0.0],
      "zeroCommandProbability": 1.0
    },
    "termination": {
      "minimumBaseHeight": 0.5,
      "minimumUprightCosine": 0.25,
      "jointLimitToleranceRadians": 0.02
    },
    "reward": {
      "survival": 1.0,
      "trackingLinear": 1.0,
      "trackingYaw": 0.25,
      "upright": 2.0,
      "baseHeight": 1.0,
      "pose": 0.5,
      "verticalVelocityCost": 0.5,
      "angularVelocityXYCost": 0.1,
      "torqueCost": 0.000002,
      "actionRateCost": 0.01
    },
    "targets": {
      "baseHeight": 0.98
    },
    "sigmas": {
      "tracking": 0.5,
      "upright": 0.1,
      "baseHeight": 0.04,
      "pose": 0.5
    },
    "commandResampleSteps": 500
  },
  "qualityGates": {
    "baselineMeanEpisodeLength": 87.34375,
    "minimumFinalMeanEpisodeLength": 350.0,
    "minimumImprovementRatio": 2.0,
    "deterministicEvaluationDurationSeconds": 4.0,
    "requiredDeterministicPasses": 5,
    "maximumPlanarDrift": 0.2
  },
  "artifactPolicy": {
    "checkpoint": "research_only",
    "distribution": "internal_only"
  },
  "evidenceStatus": "derived"
}
